{
  "version": 1,
  "limits": {
    "max_screen_flashes_per_s": 3,
    "max_flash_alpha": 0.9,
    "sprite_flash_min_interval_ms": 334,
    "max_shake_intensity": 0.012,
    "max_shake_ms": 300,
    "max_particles_high": 150,
    "max_particles_low": 60,
    "max_emitters": 8,
    "low_quality_frame_ms": 22.2,
    "low_quality_window_frames": 120
  },
  "colors": {
    "aura": {
      "blaze": "#ff6a3d",
      "gale": "#3ddc97",
      "stone": "#c9a36b",
      "radiant": "#ffd84a",
      "void": "#9b6bff"
    },
    "card_type": {
      "fist": "#d9483b",
      "bolt": "#3a7fd9",
      "signature": "#9a52d9",
      "climax": "#e8a21f"
    },
    "rarity": {
      "3": "#5aa9ff",
      "4": "#b06bff",
      "5": "#ffc23d"
    },
    "white": "#ffffff"
  },
  "effects": {
    "ignition_default": {
      "duration_ms": 1500,
      "priority": 3,
      "layers": [
        {
          "kind": "screen_flash",
          "start_ms": 0,
          "duration_ms": 120,
          "color": "white",
          "alpha": 0.9
        },
        {
          "kind": "particles",
          "start_ms": 0,
          "duration_ms": 1200,
          "count": 40,
          "life_ms": 600,
          "color": "aura"
        },
        {
          "kind": "shake",
          "start_ms": 600,
          "duration_ms": 200,
          "intensity": 0.008
        }
      ]
    },
    "hit_spark": {
      "duration_ms": 400,
      "priority": 0,
      "layers": [
        {
          "kind": "particles",
          "start_ms": 0,
          "duration_ms": 400,
          "count": 6,
          "life_ms": 300,
          "color": "aura"
        }
      ]
    },
    "ko_default": {
      "duration_ms": 1200,
      "priority": 2,
      "layers": [
        {
          "kind": "shake",
          "start_ms": 0,
          "duration_ms": 250,
          "intensity": 0.01
        }
      ]
    }
  },
  "events": {
    "ignition": [
      "ignition_default"
    ],
    "hit.fist": [
      "hit_spark"
    ],
    "ko": [
      "ko_default"
    ],
    "hit_discarded": []
  },
  "summon_timing": {
    "charge_ms": {
      "3": 260,
      "4": 420,
      "5": 700
    },
    "hold_ms": {
      "3": 850,
      "4": 1150,
      "5": 1900
    }
  }
}
